{
  "schemaVersion": 1,
  "authorityDomain": "verified-media",
  "videoId": "hb_28",
  "recordId": "hollowed:28",
  "verificationState": "verified",
  "torrent": {
    "infoHash": "5dadd569df49eb25e19938fea8705789d34d2b48",
    "fileSelection": {
      "fileIdx": 0,
      "filename": "Hollowed Bleach 28 - The Pendulum Keeps Swinging (sub).mp4",
      "byteSize": 987184248
    },
    "networkEvidence": {
      "trackers": {
        "state": "unresolved"
      },
      "announceUrls": {
        "state": "unresolved"
      },
      "webSeeds": {
        "state": "unresolved"
      }
    }
  },
  "media": {
    "duration": {
      "state": "verified",
      "measurement": "container",
      "seconds": 2072.528792
    },
    "video": {
      "codec": "HEVC",
      "standard": "H.265",
      "profile": "Main",
      "width": 1920,
      "height": 1080,
      "pixelFormat": "yuv420p"
    },
    "audioTracks": [
      {
        "language": "English",
        "codec": "AAC",
        "profile": "LC",
        "channels": 2,
        "channelLayout": "stereo"
      }
    ],
    "subtitleTracks": []
  },
  "verificationBases": [
    {
      "evidenceId": "hb28-local-torrent-verification",
      "kind": "local-torrent-verification",
      "verificationState": "verified",
      "method": "canonical-bencode-v1-creation-and-independent-piece-verification",
      "artifact": {
        "relativePath": "sources/torrents/hollowed-current-raw/Hollowed Bleach 28 - The Pendulum Keeps Swinging (sub).mp4.torrent",
        "retention": "ignored-local-workspace",
        "sha256": "596439400f26e9f9802eb18ad4a3c1d4ca3142eeb816b57cc1efb23e4ca140c6"
      },
      "verification": {
        "pieceLength": 1048576,
        "pieceCount": 942,
        "verifiedPieces": 942,
        "mismatches": 0,
        "rawInfoMatchesCanonicalEncoding": true,
        "payloadFilenameMatchesLocalMedia": true,
        "payloadByteSizeMatchesLocalMedia": true
      }
    },
    {
      "evidenceId": "hb28-local-media-ffprobe-inspection",
      "kind": "local-media-inspection",
      "method": "ffprobe",
      "verificationState": "verified",
      "artifact": {
        "relativePath": "sources/04 - Hollowed Bleach [WIP]/Hollowed Bleach 28 - The Pendulum Keeps Swinging (sub).mp4",
        "retention": "ignored-local-workspace",
        "byteSize": 987184248
      }
    }
  ],
  "fieldEvidence": {
    "/torrent/infoHash": [
      "hb28-local-torrent-verification"
    ],
    "/torrent/fileSelection/fileIdx": [
      "hb28-local-torrent-verification"
    ],
    "/torrent/fileSelection/filename": [
      "hb28-local-torrent-verification"
    ],
    "/torrent/fileSelection/byteSize": [
      "hb28-local-torrent-verification"
    ],
    "/media/duration": [
      "hb28-local-media-ffprobe-inspection"
    ],
    "/media/video/codec": [
      "hb28-local-media-ffprobe-inspection"
    ],
    "/media/video/standard": [
      "hb28-local-media-ffprobe-inspection"
    ],
    "/media/video/profile": [
      "hb28-local-media-ffprobe-inspection"
    ],
    "/media/video/width": [
      "hb28-local-media-ffprobe-inspection"
    ],
    "/media/video/height": [
      "hb28-local-media-ffprobe-inspection"
    ],
    "/media/video/pixelFormat": [
      "hb28-local-media-ffprobe-inspection"
    ],
    "/media/audioTracks": [
      "hb28-local-media-ffprobe-inspection"
    ],
    "/media/subtitleTracks": [
      "hb28-local-media-ffprobe-inspection"
    ]
  }
}
